,LIB,PP,LG,MEPID,CODICT,speech,SPEAKER_TYPE
16,Malik | Azmani,Renew,NL,197781,197781," – Voorzitter, allereerst moet mij van het hart dat de Raad bij dit belangrijke debat vandaag kennelijk niet vertegenwoordigd is. Hoe blij ik ook ben dat commissaris Dalli hier aanwezig is, is het natuurlijk ook een beetje minachting dat de migratiecommissarissen, die er verantwoordelijk voor zijn, of de voorzitter van de Commissie hier vandaag niet zijn, want voor ons – Renew Europe – is dit een belangrijk debat. Het is niet voor niks een debat van prioritair belang voor dit parlement.
We hebben grote stappen gezet, ook in dit parlement, als het gaat om het migratiepact. Volgens mij is het enige wat nog moet worden meegegeven: implementatie, implementatie en implementatie van het migratiepact. We hoeven daar geen twee jaar over te doen. Liever vandaag dan morgen.
Maar waar we nog stappen moeten zetten, is op het terugkeerbeleid. Want wanneer asielzoekers zijn afgewezen in een Europees land, wil ik niet dat ze het in een ander land opnieuw proberen. Door goede Europese samenwerking kunnen we voorkomen dat asielzoekers gaan rondzwerven door Europa. Voor mij is het heel logisch: het terugkeerbesluit dat in één land wordt uitgevaardigd, zal moeten gelden voor de hele Europese Unie. We hebben juist Europese maatregelen nodig om de asielinstroom, ook naar Nederland, te verlagen. We zien dat een dergelijke samenwerking haar vruchten afwerpt. Mede door het migratieakkoord met Tunesië zijn de aankomsten via de Middellandse Zeeroute met meer dan zestig procent gedaald.
Daarom moeten we ook de politieke durf hebben om het terugkeerbeleid Europees te regelen door ook samen op te treden tegen derde landen die weigeren om mee te werken aan de terugname van afgewezen asielzoekers. Want als lidstaten dit op eigen houtje doen, dan gaat het ons niet lukken. Zolang lidstaten hun eigen belang blijven verkiezen boven Europese samenwerking, komen we nergens. Dus alleen samen kunnen we deze fundamentele oplossingen bieden.",
17,Diana | Riba i Giner,Verts/ALE,ES,197832,197832," – Señora presidenta, señora comisaria, tropiezan una y otra vez con la misma piedra y no aprenden la lección: este Parlamento ha denunciado reiteradamente el chantaje que sufre la Unión Europea por parte de terceros países como, por ejemplo, Turquía o Marruecos, los cuales ustedes han decidido convertir en nuestros guardianes fronterizos; de hecho, hemos visto, de forma muy cruda, cómo el Gobierno marroquí, por poner un ejemplo, convertía a miles de seres humanos en armas políticas y los empujaba contra la frontera de Ceuta y Melilla, para presionar, en este caso, al Gobierno del Estado español. Y, encima, consiguen cosas —seguimos enviando miles de millones de euros de fondos europeos— y también logros políticos, como que, por ejemplo, hoy en día España reconozca la soberanía marroquí sobre el Sáhara.
Nos preocupa sobre todo también que hagamos caso a la carta de la presidenta Von der Leyen, que ha respaldado las ideas de Meloni en torno a Albania como una forma innovadora y creativa de pensar, cuando se trata de la misma receta de siempre.
Señorías, si son capaces de ponerse de acuerdo con Mohamed VI o Erdoğan, podemos ponernos de acuerdo para establecer políticas migratorias eficaces, justas...
(la presidenta retira la palabra a la oradora)",
18,Ilaria | Salis,The Left,IT,257127,257127," – Signora Presidente, onorevoli colleghi, con la vergognosa operazione in Albania di coloniale memoria, il governo italiano si è fatto avanguardia di un attacco europeo contro le migrazioni e il diritto d'asilo.
Il tentativo, per ora fallito, di esternalizzare la detenzione in un campo di concentramento su territorio straniero e di accelerare le procedure di valutazione e rimpatrio dei migranti rappresenta: 1, una crudele sofferenza e umiliazione per le persone deportate in alto mare e trattate come umanità sacrificabile; 2, una prova di assoluta incompetenza, dato che l'illegittimità dell'operazione era evidente fin dall'inizio; 3, un'inquietante forzatura da destra del diritto internazionale che tutela i diritti delle persone in movimento.
Normalmente, un governo che ha esposto il proprio Paese a una simile figuraccia internazionale dovrebbe dimettersi per manifesta incapacità e mancanza di etica. Il Parlamento europeo dovrebbe prendere le distanze e condannarlo. L'operazione Albania dovrebbe essere immediatamente interrotta, mentre dobbiamo impegnarci per creare canali sicuri per la migrazione.",
19,Mary | Khan,ESN,DE,256957,256957," – Frau Präsidentin, Frau Kommissarin! Es wurde ja so schön über Zahlen gesprochen, aber allein bis September dieses Jahres sind 166 000 Menschen illegal in die EU gekommen, und die Dunkelziffer liegt deutlich höher.
Seit 2015 kämpfen wir mit diesem Problem, und erst jetzt wird in diesem Haus darüber gesprochen. Diese Union trägt vor allem maßgeblich auch die Schuld daran, dass Millionen von illegalen Einwanderern auf unseren Kontinent gekommen sind und kaum abgeschoben werden können. Jetzt wird über eine Reform philosophiert, das Gemeinsame Europäische Asylsystem zu reformieren, das vor allem erst in zwei Jahren umgesetzt werden soll. Glauben Sie wirklich, dass in dieser Zeit nichts passiert? Glauben Sie, dass Fälle wie in Solingen und Mannheim auf Ihre Reform warten?
Wir brauchen keine Reform, wir brauchen auch keine weiteren Migrationsabkommen. Was wir brauchen, sind schnell gebaute, humane Einreise- und Rückkehrzentren und die Streichung von Entwicklungshilfe für Länder, die ihre illegalen Staatsbürger nicht zurücknehmen wollen. Und wir brauchen in Deutschland vor allem eine Bundesregierung, die aus dem Gemeinsamen Europäischen Asylsystem austreten möchte.",
20,Erik | Kaliňák,NI,SK,257007,257007," – Vážená pani predsedajúca, masívna nelegálna migrácia predstavuje pre Európu existenčné ohrozenie. Túto hrozbu však mnohé západné krajiny desaťročia zľahčovali a teraz žnú krvavé dôsledky svojej slniečkarskej naivity. Každého, kto ich varoval pred nebezpečenstvom politiky otvorených dverí pri migrácii, označovali za xenofóba, rasistu či extrémistu. A dnes sú šokovaní, že tí ich extrémisti získavajú väčšinu v jednom členskom štáte za druhým. Kedy už aj v tomto Parlamente pochopíme, že nelegálna migrácia nie je správna? Našou úlohou nie je donekonečna riešiť jej nezvládateľné následky, ale ju raz a navždy zastaviť. Prerozdeľovanie imigrantov, búranie Schengenu či migračný pakt: nič z toho nefunguje, lebo nič z toho nerieši príčinu nelegálnej migrácie.
Jediné funkčné riešenie tohto problému je dôsledná kontrola vonkajších hraníc a až potom prichádza na rad prísna návratová politika. Na územie Európskej únie má vkročiť len taký imigrant, čo bol dôsledne skontrolovaný a získal na to legálne povolenie. Všetci ostatní patria za hranicu, vonkajšiu hranicu Európskej únie. Áno, riešenie je naozaj také jednoduché. Tak prosím, prestaňme predstierať, že po desaťročí ideme zrazu hľadať nejaké inovatívne riešenia, lebo sme už fakt na smiech. Samozrejme, že aj toto riešenie stojí nemalé peniaze, ale čo si ich zaslúži viac než bezpečnosť našich občanov? Keď dokážeme dať nečlenskému štátu desiatky miliárd na jeho ochranu, musíme ich vedieť nájsť aj na ochranu našich hraníc, nášho spôsobu života, našej Európy.",
21,Lena | Düpont,PPE,EN,99945,99945," – Madam President, colleagues, let us, for a second, remind ourselves what the starting point last term was. Member States were not able to finalise the previous pact. The House had been kept in numerous discussions about the pact and was also not able to conclude. It took us long negotiations for a complex package and finally last year we arrived with a solution.
Is it a silver bullet? How can it be? It was always clear that it's a baseline system for the inner dimension of the European Union. We always made clear that we cannot leave it there, that we need to improve and that we need to step up. And thanks to the EPP, the external dimension was already part of that.
Therefore, and we heard the numbers, only 20 % of those who have no right to stay in the European Union are actually returned, which means we need to step up returns by various means. We need effective and meaningful third country cooperation with a European approach. We need to use the full leverage of the Visa Code, which has been at the hands of the Member States for quite some time, we need to fight trafficking and smuggling networks by all means, and we need to allow to take Frontex to take a greater role in assisting Member States in returns and in third country cooperation. And of course, we need to address instrumentalisation as a hybrid threat because it's highly sophisticated, highly cynical, but also highly beneficial for the organisers – well, it's nothing else than state-sponsored criminal networks here.
The EPP will always be the constructive force, and we will always be the ones who drive the asylum and migration policy forward.
(The speaker agreed to take a blue-card question)",
22,András | László,PfE,EN,256860,256860," – Ms Düpont, you are from the EPP. We are witnessing a severe crisis now in Europe. Still, I have a very simple question to you. Does the EPP support still the relocation of illegal migrants in Europe?
(Ms Düpont asked Mr László to repeat the question.)
Does the EPP still support the relocation of illegal immigrants in the EU between Member States?",
23,Lena | Düpont,PPE,EN,99945,99945," – If you had been part of the negotiating team of the pact, you would have well known that we found a solution for the question of relocation, for the question of solidarity and for the question of solidarity that Member States need to contribute, which is the answer to your question.",
24,Cecilia | Strada,S-D,IT,257101,257101," – Signora Presidente, onorevoli colleghi, signora Commissaria, in queste settimane si è parlato molto dei centri in Albania inaugurati dal governo Meloni, come qualcosa a cui l'Europa potrebbe guardare con interesse, un modello per le nostre future azioni.
La scorsa settimana i primi 16 migranti richiedenti asilo sono stati portati nel centro. Ecco i risultati: due erano minorenni, due erano vulnerabili, non avrebbero mai dovuto essere portati in Albania e sono stati riportati in Italia. Gli altri 14 non provenivano da Paesi sicuri secondo i giudici. Quindi non si poteva applicare la procedura accelerata di frontiera: nemmeno loro avrebbero dovuto essere portati in Albania. Tutto questo, per inciso, è costato molto di più, per ogni singola persona, rispetto a quanto non sarebbe costato se le procedure fossero state svolte direttamente in Italia.
Il centro in Albania, perciò, è un incubo logistico, è un disastro giuridico, perché non rispetta le convenzioni internazionali e la stessa legislazione dell'Unione. È una grave minaccia per i diritti umani ed è anche un danno economico piuttosto rilevante.
Il centro in Albania può essere un modello? Sì, un modello di come non vanno fatte le cose. L'Europa stia invece dalla parte della legge e dei diritti delle persone.",
25,Jean-Paul | Garraud,PfE,FR,197628,197628," – Madame la Présidente, un changement radical de politique est indispensable en matière migratoire. La Commission européenne et plusieurs États tels que la France veulent une application rapide du pacte migratoire, en faisant croire que ainsi nos pays seraient protégés. C’est totalement faux. Le pacte migratoire ne fera qu’accélérer l’immigration de masse. Quant au retour dans les pays d’origine, si Mme von der Leyen se dit à présent favorable à une politique plus ferme, elle fait tout son possible pour favoriser les entrées. Avant de parler des retours, la première des priorités, c’est de bloquer les entrées, mais la Commission ne le veut pas.
Notre politique doit passer par une gestion rigoureuse de nos frontières extérieures et par des contrôles à nos frontières intérieures, comme l’Allemagne vient de le décider. Notre politique doit être similaire à celles de l’Italie et du Danemark pour externaliser les demandes d’asile. Le financement des pays tiers doit être subordonné à la mise en œuvre des accords de retour. L’Europe doit garantir la sécurité de ses citoyens et la souveraineté de ses nations. C’est une question de justice, de sécurité et de respect de la volonté populaire.",
26,Assita | Kanko,ECR,EN,197469,197469," – Madam President, Commissioner, dear colleagues, 'They do nothing for our safety.' This was the heartfelt cry from German families about the many knife attacks in their country. They feel powerless and abandoned by us.
Citizens are deeply concerned about the EU's failing migration policy. Integration is non-committal and border control barely exists. Taboos about protecting external borders and the illusion that return policy is a solution prevail, while only 20 % actually return.
Therefore, Germany, France and others are reintroducing internal border controls out of justified fear of attacks and to stop illegal migration – understandable, but this destroys our prosperity because we have internal borders popping up here and there. Europe loses a substance that guarantees the single market. Who will bear the brunt of this? The consumer, the traveller and our businesses.
If the EU still wants to be relevant, it's time to act more decisively. Throwing more money at Frontex will not help. Reviewing the agency's mandate and turning it into a real border protection agency will, and equipping, not hindering, the Member States to protect the EU external borders. I count on the new Commission to get serious about this.",
27,Fabienne | Keller,Renew,FR,22858,22858," – Madame la Présidente, Madame la Commissaire, «les migrations sont un défi européen exigeant une réponse européenne». Ces mots sont inscrits dans les conclusions de la réunion des chefs d’État du 17 octobre dernier. Voilà notre boussole pour gérer efficacement la migration, qui a conduit à l’adoption d’un accord historique au printemps dernier: le pacte européen sur l’asile et la migration.
Ce pacte offre des outils nouveaux et puissants pour lutter contre les flux irréguliers et pour décourager le départ des personnes qui ne relèvent pas de l’asile grâce à la procédure d’asile à la frontière, pour accélérer l’examen des demandes d’asile et pour protéger rapidement ceux qui sont persécutés, mais aussi pour assurer, grâce à ce pacte et à ces outils, un partage de responsabilités équitable et une solidarité nécessaire entre les États membres. Ce pacte est une véritable révolution, chers collègues, et la priorité des priorités, c’est d’assurer sa bonne mise en œuvre.
Je m’oppose fermement aux solutions dites innovantes d’externalisation de la politique des retours dans des hubs loin de chez nous. Il nous faut bien sûr travailler sur une nouvelle directive sur les retours. Cependant, de tels centres seraient inefficaces, coûtent une fortune aux contribuables et nous rendraient vulnérables au chantage de pays tiers, sans pour autant régler le sujet délicat de l’obtention des laissez-passer. Les unes après les autres, les tentatives des gouvernements de créer de tels systèmes se révèlent être des impasses. L’abandon de l’accord passé par le Royaume-Uni avec le Rwanda en est un exemple. Restons souverains et maîtres de notre politique d’immigration.
(L'oratrice refuse une question carton bleu de Fabrice Leggeri)",
28,Erik | Marquardt,Verts/ALE,DE,197462,197462," – Frau Präsidentin, Frau Kommissarin! Von den konservativen Kollegen wurde ja gerade gesagt: „Wir wollen die Kontrolle zurückgewinnen.“ Aus meiner Sicht ist das richtig. Es ist nur aus meiner Sicht auch richtig, mal festzustellen, dass die Wahrheit ist, dass wir in den letzten Jahren die Kontrolle verlieren, weil wir die Regeln, weil wir die Gesetze, die wir uns selbst gegeben haben, nicht mehr einhalten, teilweise auch nicht mehr einhalten wollen.
In Italien haben wir es gerade gesehen, wenn es um Grundrechte geht: Man darf in Demokratien Minderheiten nicht einfach einsperren, nur weil Mehrheiten das wollen. Daran erinnern sie Gerichte, und dann versuchen sie nicht, die Regeln einzuhalten, sondern die Gerichte anzugreifen. Das finde ich unerhört, muss ich ehrlich sagen, und ich finde auch unerhört, dass wir es nicht schaffen, bei Abkommen – und ich habe Ihnen genau zugehört, Frau Dalli – wie mit Tunesien und Libyen, wo man ja seine politischen Ziele haben kann, aber wo man auf der anderen Seite doch dafür sorgen muss, dass Frauen dort nicht systematisch vergewaltigt werden, dass Menschen nicht systematisch irgendwo eingesperrt oder sogar in die Wüste geschickt werden. Das sind doch Dinge, die für das Zusammenleben, für die Zusammenarbeit in der Migrationspolitik wichtig sind.
Geben Sie mir bitte dazu noch zwei Sätze. Das Erste ist: Ich erwarte von der Kommission, dass sie diese Grausamkeiten bei der externen Zusammenarbeit endlich anerkennt. Und ich erwarte von uns gemeinsam und besonders den Konservativen, dass wir den Migrationspakt ordentlich umsetzen. Bitte schielen Sie nicht nach rechts, wir kriegen das zusammen hin.",
29,Konstantinos | Arvanitis,The Left,EL,197701,197701," – Κυρία Πρόεδρε, αγαπητοί συνάδελφοι, άκουσα να υποστηρίζεται η άποψη να εμποδίσουμε τις αφίξεις. Μήπως να απεμπλακούμε από τις αιτίες που δημιουργούν το πρόβλημα;
Εδώ και πέντε χρόνια τονίζουμε ότι αυτό το νέο σύμφωνο που μας φέρατε θα είναι το τέλος του δικαιώματος στο άσυλο, θα είναι η ταφόπλακα της ευρωπαϊκής αλληλεγγύης. Εμείς το λέγαμε αυτό. Επιμείναμε και επιμένουμε ότι πρέπει να δούμε το θέμα των νόμιμων οδών μετανάστευσης, να εξετάσουμε το θέμα της υποχρεωτικότητας μεταξύ των κρατών μελών όσον αφορά την μετεγκατάσταση. Τι ιδέα ήταν αυτή, ο «εθελοντικός» χαρακτήρας; Τώρα βλέπουμε τα θέματα της Γερμανίας και αύριο της Γαλλίας. Μετατρέπετε ουσιαστικά τις χώρες υποδοχής σε στρατόπεδα της Ενωμένης Ευρώπης. Έχουμε και αυτή τη νέα ιδέα με την Αλβανία, δηλαδή στρατόπεδα εντός της Ευρώπης, αλλά εκτός της Ευρωπαϊκής Ένωσης.
Ειλικρινά πιστεύετε ότι κλείνοντας τα μάτια στην πραγματικότητα, διώχνοντας όσο πιο μακριά γίνεται από τις χώρες σας το πρόβλημα, όπως το θεωρείτε, δημιουργώντας τέτοιες συνθήκες, λύνετε ή ουσιαστικά συμβάλλετε σε ένα τεράστιο ανθρωπιστικό πρόβλημα, σε μια τεράστια κρίση;",
30,Monika | Beňová,NI,SK,23868,23868," – Vážená pani predsedajúca, ďakujem veľmi pekne, pani predsedajúca a pani komisárka. Vidím tu kolegov z Fideszu. Pamätajú si určite, keď sme v roku 2015 alebo 2016 na mimoriadnom zasadnutí Európskeho parlamentu v Bruseli boli donútení prijať rozhodnutie o povinnom prerozdeľovaní migrantov. Hovoríme o období spred deviatich rokov. Deväť rokov toto nefungovalo a napriek tomu sa to znovu dostalo do migračného paktu. Keď vieme, že to nefunguje, nefunguje nám ochrana vonkajšej hranice, nefunguje už ani Schengen, nefunguje nám návratová politika, nefunguje vlastne nič: nechápem Váš optimizmus, pani komisárka, keď ste tu vystúpili a povedali, že už nám chýba len ten posledný kúsok, doriešiť návratovú politiku. Návratová politika stojí Európsku úniu a jej členské štáty obrovské množstvo peňazí. A ešte ku kolegom, progresívcom a socialistom: my nie sme proti legálnej migrácii, ale tu hovoríme o ilegálnej migrácii. Hovoríme o tom, ako sa s tým majú členské štáty vysporiadať bez podpory Európskej komisie.",
31,Dolors | Montserrat,PPE,ES,197711,197711," – Señora presidenta, la frontera sur de Europa —Canarias, Ceuta y Melilla— está en grave riesgo de colapso ante la llegada constante de inmigrantes irregulares. Las mafias que trafican con personas no eligen al azar dónde envían sus pateras. Canarias, Ceuta y Melilla son las tres zonas que más inmigración irregular reciben hoy en toda Europa. Y no es por casualidad. Lo son porque el Gobierno de España no defiende nuestras fronteras ni a nuestros cuerpos de seguridad, elude la cooperación internacional, desoye a Europa y desprecia la ayuda de Frontex.
Señores socialistas, la política migratoria más inhumana es la que no existe, la que permite que las mafias campen a sus anchas y miles de personas mueran en el océano. La inacción y la irresponsabilidad del Gobierno de Sánchez no solo están poniendo en peligro la seguridad de la Unión Europea, sino la de los miles de migrantes utilizados por las mafias.
¿Y saben por qué? Porque al presidente Sánchez solo le preocupa aferrarse al poder y no dimitir ante los casos de corrupción que le acechan en su Gobierno, en su partido y en su entorno personal. Es inadmisible que el mismo presidente Sánchez que tarda un minuto en entregar una amnistía a un prófugo de la Justicia, que no duda en excarcelar a presos etarras, que asalta cada día las instituciones —como ayer la televisión pública española—, tenga a Canarias, Ceuta y Melilla agonizando, sin ayuda para atender a los menores no acompañados ni recursos para afrontar esta grave crisis migratoria.
El verdadero efecto llamada europeo se llama Pedro Sánchez. Europa debe actuar ya. Y obliguen a Sánchez a implementar el Pacto sobre Migración y Asilo.",
32,Matjaž | Nemec,S-D,SL,233862,233862," – Gospa predsednica! Ni problem politika Pedra Sancheza ali pa Španije, ampak neučinkovita in celostna migracijska politika Evropske unije, ki še ne deluje.
Dandanes migracije poganjajo kompleksni vzroki in krizna žarišča po vsem svetu in naš problem niso vračanja. Ampak nasprotno, naša največja težava je, da Evropa še naprej financira avtoritarce v severni Afriki, ki grobo zatirajo svoje lastne državljane. Kot tudi, da Evropa podpira obalne straže, ki istočasno igrajo vlogo tihotapcev ljudi. In to tudi, da Evropa še naprej pošilja orožje na krizna žarišča kot vključno z Izraelom.
Kako se lahko Evropa tako kratkovidno pretvarja, da naša politika in dejanja nimajo nobenih posledic? Seveda jih imajo.
Spoštovani, po osmih letih smo letos pred volitvami potrdili pakt o migracijah in azilu. Čeprav ta ni idealen, ponuja odgovore na izzive migracij.
Sedaj pa se moramo osredotoči na izvajanje sprejetega svežnja kot tudi na integracijo, učinkovito obravnavo ter seveda na sprejem. Ne pa na všečne ukrepe in besede, ki v resnici ne bodo imele učinka, kot tudi priseljevanja v Albanijo ne. In s tem bomo le pospešili in ojačali tok po Zahodnem Balkanu in seveda njeno pot pospešili do severa.",
33,Paolo | Borchia,PfE,IT,101039,101039," – Signora Presidente, onorevoli colleghi, questo dibattito avviene a pochi giorni da un drammatico fatto di sangue accaduto a Verona, la mia città, bellissima e ospitale, che si trova in Veneto, storicamente terra di emigrazione e di integrazione: un ragazzo maliano ha perso la vita dopo aver aggredito con un coltello un agente di polizia che, per difendersi, ha dovuto aprire il fuoco.
Questo è un episodio, uno dei tanti, che testimonia che, quando in un territorio arriva un numero spropositato di stranieri, la maggior parte dei quali non ha diritto alla protezione internazionale, poi diventa impossibile gestirne l'accoglienza.
Io avrei voluto, colleghi, che questo dibattito si svolgesse in maniera concreta e non ideologica, senza l'illusione che in Europa esistano opportunità e possibilità illimitate di accoglienza. Il titolo è ""Gestione ordinata ed efficacia della migrazione"": perfetto, il contrario di tutto quello che abbiamo visto finora.
In conclusione, vorrei esprimere il mio sgomento per il rapporto della commissione contro il razzismo e l'intolleranza dei nostri vicini di casa del Consiglio d'Europa che ""sputa veleno"" sulle forze dell'ordine italiane che, ricordo, vanno applaudite, non diffamate.
(L'oratore accetta di rispondere a una domanda ""cartellino blu"")",
34,Maria | Grapini,S-D,RO,124785,124785," – Stimate coleg, migrația este o problemă, într-adevăr, dar ați spus că nu sunteți de acord cu ceea ce s-a dezbătut și ați fi vrut să dezbatem concret cum să facem ca migrația ilegală să nu mai fie și, în același timp, să-i ajutăm pe cei care pleacă din motive economice. Spuneți-mi, care ar fi fost sau care sunt punctele dumneavoastră de vedere? Ce măsuri concrete aveți dumneavoastră pentru pactul pe migrație?",
