,LIB,PP,LG,MEPID,CODICT,speech,SPEAKER_TYPE
35,Paolo | Borchia,PfE,IT,101039,101039," – Grazie collega della domanda, che mi dà l'opportunità di spiegare il nostro punto di vista. Chiaramente, le perturbazioni a livello geopolitico, a livello internazionale, ci dimostrano che adesso bisogna fare delle scelte, perché dovremo gestire un numero sempre crescente di persone che richiedono asilo.
Visto che le cifre ci dicono che la maggior parte delle richieste vengono rifiutate perché mancano i presupposti, noi non possiamo covare l'illusione che in Europa ci siano spazi, opportunità e modalità d'accoglienza per tutti quanti, per cui bisognerà fare delle scelte.",
36,Charlie | Weimers,ECR,EN,123562,123562," – Madam President, colleagues, the right won the election. Securing the border – once rejected as heresy – has become mainstream. The Council, even the Commission, recognise the need to prevent illegal entry, host refugees outside the EU and swiftly deport illegal migrants. But will the European Parliament defend Europe or open the floodgates?
On Monday, this House rejected the left's attempt to control the debate on migration. Now they will use their superpower – their unrivalled ability to whine and cry. For the past decade, this House has indulged the left colleagues. We cannot afford to lose another decade to leftist tears. There is a right‑wing majority in this House to stop illegal migration, stop asylum abuse, and stop the weaponisation of migrants. It's time we use it.",
37,Abir | Al-Sahlani,Renew,SV,197400,197400,"hur det ska gå till.
Återvandring utan att ta hänsyn till möjligheterna för den som återvänder att reintegreras är inte svaret. Återvandring utan att ta hänsyn till förutsättningarna i mottagarländerna är inte svaret. Återvandring utan fokus på behovet hos den enskilda mänskliga situationen, människorna bakom statistiken, är inte svaret. Att hela tiden svara ”skicka tillbaka” är inte svaret.
Svaret däremot är migrationspakten. Säkra och lagliga vägar in måste vara kärnan i den europeiska migrationspolitiken, som alltid bygger på respekten för de mänskliga rättigheterna och att garantera människors säkerhet. Vårt enda svar kan inte vara att skicka tillbaka. Återvändande måste vara en del av ett ramverk. Återvändande måste vara en del, en pusselbit, i vår migrations helhet.
(Talaren godtog en fråga (""blått kort"").)",
38,Rihards | Kols,ECR,EN,220871,220871," – I have a very simple question. We talk about returns. The definition of returns, according to the legal basis, is actually 'expulsion'. It's not about returning somebody who's wandering around Europe; we are returning those who are not eligible for international protection. And that is the question.
So do you see the equal sign between returns and expulsion? Expulsion is a legal decision by law enforcement institutions that is not a political decision and should be enforced.",
39,Abir | Al-Sahlani,Renew,EN,197400,197400," – I maybe do not see the conflict in your question or the big issue in your question. I do believe that what we are differing in is 'how do we do it?' Nobody here is defending the overstay of everyone here. No one is defending that.
What we are talking about is: how do we make people return? How do we enable them actually to have a life in dignity when they go back home? How do we make their countries of origin receive them? And how do we make sure that these people are not in a limbo where nobody wants them and their lives are put on hold?",
40,Ignazio Roberto | Marino,Verts/ALE,IT,257132,257132,"... migrazione efficace e olistica, dice il titolo. Suggerisco di iniziare dall'onestà intellettuale, assente in quella parte di quest'Aula due giorni fa, che bocciò la discussione sulla deportazione e la detenzione in un lager al di fuori dei confini europei, di migranti che fuggono per sottrarsi alla violenza, alla fame, alla povertà.
L'accordo del governo Meloni con l'Albania ha un precedente: la base di Guantánamo, dove i prigionieri possono essere trattati al di fuori della legge. Ma nel caso di Guantánamo si tratta di sospetti di terrorismo. Qui si tratta del trattamento ""olistico"" di persone disperate.
Immagino che ognuno di voi ieri sera, compreso l'onorevole Procaccini, che ringrazio per l'ascolto, abbia avuto un'ottima cena e questa mattina una tonificante doccia calda. Ecco allora la visione olistica nelle parole del vicepresidente del Consiglio italiano, cito: ""I confini sono sacri e cani e porci arrivano in Europa"". Non so per i porci, ma i nostri amati cani domestici, in Europa, ricevono un trattamento ben più olistico che il governo Meloni...
(La Presidente toglie la parola all'oratore)",
41,Siegfried | Mureşan,PPE,EN,124802,124802," – Madam President, dear colleagues, Russia and Belarus are exploiting migrants in an attempt to destabilise the European Union. They are sending people illegally across the border into the European Union, challenging, threatening our security. This is a danger for the security of the European Union. We need to recognise this and we need to act on this. Anything illegal has to be tackled. The European Union needs to stand up for the rule of law. We need to defend the rule of law. Illegal migration is to be tackled. That is why a proposal on returns is to be welcomed.
We are now seeing an instrumentalisation of migration against the security of the European Union, with a clear attempt to divide us by the autocracies around the European Union. Russia is trying to instrumentalise migration against us through Belarus towards Poland. They will not hesitate to work with countries that are close to them in the Middle East and in Africa to continue to instrumentalise migration. We need to recognise this. We need to protect our borders properly. We need to protect ourselves from autocrats who are trying to destabilise our democracies, and we need to protect our external border as well, so that the freedom of movement inside the European Union can continue.",
42,Jorge | Buxadé Villalba,PfE,ES,197829,197829," – Señora presidente, contra la inmigración ilegal, deportación: contra las inmigraciones masivas, deportaciones masivas. Se fomenta el empleo, la iniciativa empresarial, la producción industrial o la práctica del deporte, pero que los inmigrantes que entran ilegalmente en Europa se devuelvan a sus países no es una opción que haya que fomentar, es cumplir la ley. Los europeos quieren deportaciones masivas y están hartos de la palabrería cosmética de Von der Leyen.
Hace seis días, sesenta y cinco pakistaníes entraron en Europa ilegalmente por las islas Canarias en un barco de las mafias. La ruta más corta desde Pakistán a España es Irán, Irak, Jordania, Israel, Egipto, Libia, Argelia, Túnez, Marruecos y Mauritania. Nueve estados musulmanes los han dejado pasar, pero ¿por qué no se quedan ahí? ¿Y cuántos de estos pakistaníes forman parte del Estado Islámico y vienen a cometer atentados terroristas a Europa? No tenemos ni una sola información. ¿Qué impide meter a esos sesenta y cinco pakistaníes en un avión y mandarlos a Islamabad? Solo su debilidad y su complicidad. Así que basta de palabrería: todo lo que no sea combatir las mafias y devolverlos a sus países no lo vamos a aceptar.",
43,Elena | Yoncheva,Renew,EN,197842,197842," – Madam President, if you want the European migration policy to be fair to those who need protection, it should be firm and effective to others who don't have the right to stay. Almost half of the people who arrive in Europe do not receive asylum status. Last year, less than 20 % of those with return decisions were actually returned. Yes, Commissioner Dalli, we need to do more. Returns is the missing puzzle in the European Union migration policy. We need a new and effective return policy, but we also need the right approach.
Lessons must be learned from the Italian–Albanian deal. Such deals are expensive and ineffective, and open the door to legal challenges. What is most worrying, some Member States see this as a way to avoid the implementation of the migration pact. Instead, we should focus on working with countries of origin, establishing sustainable partnership and implementation of the migration pact without delay.",
44,Ελισσάβετ | Βόζεμπεργκ-Βρυωνίδη,PPE,EL,125065,125065," – Κυρία Πρόεδρε, στο Ευρωπαϊκό Συμβούλιο στις 17 Οκτωβρίου συζητήθηκε εκτενώς το ζήτημα της μετανάστευσης υπό το βάρος νέων πρόσφατων πρωτοβουλιών, όπως της Γερμανίας με προσωρινούς ελέγχους στα εσωτερικά σύνορα και της Ιταλίας με τη μεταφορά μεταναστών στην Αλβανία. Δεν θα σταματήσουμε να τονίζουμε ότι η αντιμετώπιση του θέματος απαιτεί υπεύθυνη από όλα τα κράτη μέλη εφαρμογή της νέας νομοθεσίας που στηρίζεται στην αλληλεγγύη. Η ίση κατανομή βαρών, η πάταξη των κυκλωμάτων των διακινητών και η φύλαξη των εξωτερικών συνόρων της Ένωσης αποτελούν βραχίονες του νέου πακέτου. Οι επιστροφές, επιπρόσθετα, εγγυώνται και καθορίζουν την επιτυχή εφαρμογή του. Γι' αυτό, οι ηγέτες της Ένωσης ζήτησαν από την Επιτροπή νομοθετική πρόταση άμεσα και τάχιστα για τις επιστροφές και σαφή αναγνώριση των ασφαλών τρίτων χωρών. Απαιτείται από όλους μας ενιαία στάση και άμεση εφαρμογή της νομοθεσίας που πρόσφατα ψηφίσαμε. Όταν μιλάμε για δίκαιη ευρωπαϊκή μεταναστευτική πολιτική, οφείλουμε και να το εννοούμε.",
45,Tom | Vandendriessche,PfE,NL,185771,185771," – Voorzitter, tijdens dit debat komen er opnieuw honderddertig asielzoekers bij in Europa. Elk uur van elke dag van elke maand. Meer dan drieduizend asielzoekers per dag. De helft van hen zijn bovendien asielbedriegers. Ze misbruiken asielrecht om te migreren en vier van de vijf van deze gelukzoekers keren bovendien helemaal niet meer terug. Tijdens het debat komen er dus vijftig illegalen bij in Europa.
De Europese Unie observeert, debatteert, overweegt, palavert en delibereert, maar weigert tot actie over te gaan. Nochtans is de oplossing evident. Illegalen moeten we actief opsporen en terugsturen. Landen die hun illegalen niet willen terugnemen, mogen geen euro aan ontwikkelingshulp meer ontvangen. We kunnen hen economisch boycotten, visumsancties opleggen en financiële stromen stoppen, totdat ze meewerken. De Europese Unie kan hier haar meerwaarde bewijzen. Waarom gebeurt dat eigenlijk niet?",
46,Rasa | Juknevičienė,PPE,LT,197840,197840," – Gerbiama Pirmininke! Gerbiami kolegos, tarptautinėje teisėje susiduria dvi konkuruojančios vertybės – ir abi labai svarbios - individualios migrantų teisės ir valstybės saugumas, teritorinis vientisumas. Antroji nėra pakankamai įtvirtinta mūsų teisėje. Sienų apsauga yra esminė prielaida valstybės saugumui. Mes privalome iš esmės pakeisti savo išorės sienų apsaugos politiką. Be išorinių sienų apsaugos, įskaitant fizines sienas, nebus veiksmingo Šengeno. Kairiųjų migracijos politika nelegalios migracijos atžvilgiu atvedė į šią salę kraštutinius radikalus. Nelegali instrumentalizuota migracija tampa diktatorių ginklu prieš demokratijas. Turime tai sustabdyti!",
47,Harald | Vilimsky,PfE,DE,125001,125001," – Frau Präsidentin, meine sehr geehrten Damen und Herren! Die gesamte Irrwitzigkeit der sogenannten Migrations- und Flüchtlingsthematik zeigt sich an einem aktuellen Beispiel in meiner Heimatstadt Wien, wo eine syrische Familie die Summe von 4 600 Euro netto Monat für Monat von der öffentlichen Hand erhält. Und neben diesen 4 600 Euro, die diese syrische Familie in Wien erhält, kommt noch ein Klimabonus dazu, der einmalig im vergangenen Monat im Ausmaß von über 400 Euro bezahlt wurde, und dazu noch eine sogenannte Mietzinsbeihilfe, sodass in Summe diese syrische Familie 5 500 Euro von der öffentlichen Hand erhält, und das ist mehr als das Doppelte, was ein normaler Arbeiter hier in meiner Heimatstadt verdient.
Das heißt also, dass hier eine ganz große Diskussion darüber entstanden ist, dass diejenigen, die Steuern zahlen, die zum allgemeinen Wohl beitragen, hier auf der anderen Seite Personen finanzieren, die unter dem Titel der Schutzwürdigkeit zu uns gekommen sind und zu zwei Dritteln – und das zeigen alle Statistiken – nicht schutzwürdig sind, weder Genfer Konventionsstatus erhalten, weder subsidiär noch humanitär entsprechenden Schutzstatus genießen.
Die einzige Lösung kann nur sein, diesen Menschen in ihrer Heimat zu helfen, sie auf ihrem Kontinent zu halten und sie nicht mehr nach Europa zu lassen.",
48,François-Xavier | Bellamy,PPE,FR,197534,197534," – Madame la Présidente, nous voulons effectivement remettre sur la table la directive retour, et, parce que nous avons imposé ce débat, la gauche hurle au scandale. J’entendais nos collègues de Renew, comme Valérie Hayer, immédiatement crier au populisme. Mes chers collègues, dans quel monde vivez-vous?
L’année dernière, sur les expulsions décidées par les pays européens, seules 20 % ont été exécutées en moyenne – moins de 10 % en France. Pourquoi? Principalement à cause de notre droit. C’est la loi contre la loi. C’est le droit, souvent le droit européen et les décisions de justice, contre nos principes les plus fondamentaux, comme le droit d’asile, qui est en réalité détourné tous les jours par les mafias de passeurs, qui utilisent les vulnérabilités de notre réponse juridique.
Il est temps de sortir de l’impuissance. Si nous ne le faisons pas aujourd’hui, c’est l’idée même de la démocratie qui sera contestée dans le cœur et dans l’esprit des citoyens de nos pays. Il est temps de réagir enfin, pour que nos pays décident de qui rentre et de qui s’établit sur leur sol, plutôt que de laisser d’autres et ces mafias criminelles décider à notre place.
(L'orateur accepte une question carton bleu)",
49,Malika | Sorel,PfE,FR,256871,256871," – Votre collègue du PPE, Mme Düpont, vient de nous dire il y a quelques instants que le PPE était favorable à la répartition des migrants illégaux à travers les États membres de l’Union européenne; elle a même parlé de principe de solidarité. Est-ce que vous confirmez cela, Monsieur Bellamy?",
50,François-Xavier | Bellamy,PPE,FR,197534,197534," – C’est bien sûr totalement faux, et ceux qui pourront écouter le propos de Lena Düpont et suivre le travail que nous faisons avec nos collègues du PPE le verront avec clarté. Nous défendons le fait de mettre fin à l’immigration illégale en Europe. Nous ne voulons pas répartir les migrants illégaux; nous voulons faire en sorte qu’ils repartent. C’est tout l’objet de ce travail sur la directive retour, que nous mènerons avec tous nos collègues qui sont ici. C’est nous qui avons posé ce débat sur la table aujourd’hui, et nous sommes fiers de travailler pour faire en sorte que l’Europe construise ensemble une stratégie efficace. C’est peut être une différence que nous avons: une stratégie collective pour faire en sorte de lutter contre l’immigration illégale et pour que nos États gardent leur souveraineté sur leur politique migratoire.",
51,Paulo | Cunha,PPE,PT,257078,257078," – Senhora Presidente, Senhoras e Senhores Deputados, a crise migratória é um dos maiores desafios da nossa era. É imperativo que abordemos esta questão com humanidade e dignidade.
Em Portugal, sob a liderança do Governo da Aliança Democrática, temos implementado medidas exemplares que refletem estes valores fundamentais. O Plano de Ação para as Migrações do nosso Governo promove um sistema eficaz para acolher os que querem entrar, mas simultaneamente intransigente na fiscalização e no combate aos abusos, ao exigir um vínculo a todos os migrantes que queiram tratar da sua regularização. Assim, facilitamos a integração e reduzimos a imigração irregular. Queremos garantir que cada migrante que chega ao nosso país é tratado com respeito e tem acesso a condições de vida dignas enquanto aguarda a análise do seu pedido de asilo.
Temos que procurar soluções inovadoras que respeitem estes princípios. Além das alterações legais introduzidas, o primeiro‑ministro português anunciou recentemente a criação de centros de acolhimento para imigrantes em território português como uma nova opção para uma gestão integrada.
Somos contra o recurso a fundos comunitários para a construção de muros nas nossas fronteiras externas. Defendemos o investimento no uso de tecnologia avançada, na vigilância e na cooperação entre Estados‑Membros. A gestão eficaz e o fortalecimento das fronteiras externas da União Europeia são elementos‑chave para um espaço Schengen sem controlos das fronteiras internas. Só resolveremos a crise migratória se combatermos as...
(a Presidente retira a palavra ao orador)",
52,Bartłomiej | Sienkiewicz,PPE,PL,86057,86057," – Pani Przewodnicząca! Zanim zaczną działać mechanizmy Paktu, pilnie musimy ograniczyć napływ tych uchodźców, którzy są elementem agresji hybrydowej. Dotychczasowe procedury stawiają Unię Europejską w sytuacji bezradności. Używanie statusu azylantów jest częścią agresji Moskwy i Mińska. Często nie znamy faktycznych danych osób nielegalnie przekraczających granicę i ubiegających się o azyl. Mamy prawo wiedzieć, kto do nas przyjeżdża, a jak nie możemy wiedzieć, mamy prawo odmówić im wejścia na nasze terytorium.
W doktrynie rosyjskiej nie ma rozróżnienia między narzędziami prowadzenia wojny. Ich dyplomacja, akty dywersji, których dopuszczają się na Zachodzie, czy organizowani przez nich migranci, są takim samym instrumentem prowadzenia wojny jak ich czołgi i rakiety. Oczekuję zrozumienia tego faktu, szczególnie po lewej stronie tej sali.",
53,Loránt | Vincze,PPE,HU,98582,98582," – Tisztelt Elnök Asszony! Jó látni, jó hallani, hogy a józan ész kezd visszatérni az Európai Parlamentbe, hiszen öt évvel ezelőtt, aki olyan intézkedéseket javasolt, amelyek az illegális migrációt akarták megállítani, rögtön rásütötték a szélsőséges jelzőt. Végül sikerült ledönteni a tabukat, pontosabban a választók döntötték le a tabukat, amikor júniusban azt mondták, hogy ez fontos ügy, tessék megoldani. Mert számukra az illegális bevándorlással összefüggő támadások számának növekedése, a szociális kiadások emelkedése, az egyesek számára jól jövedelmező migránsbiznisz elfogadhatatlan.
A nyár elején utolsó száz méteren született a migrációs paktum. Félsiker, félmegoldás. Annyit sikerült akkor elérni, de az elkezdett úton most egészen végig kell menni. A kiutasítási irányelvben például nem kell majd óvatoskodni. Ez egy szigorú és egyértelmű intézkedéseket tartalmazó jogszabály kell legyen. És emellett további kiegészítő törvényekre lesz szükség, de én azt gondolom, most megvan az a parlamenti többség, amely elszánt és bátor, és képes a korábban kényelmetlennek látszó döntéseket megtenni. A polgárok erre adtak nekünk megbízást és feladatot.",
54,Paulius | Saudargas,PPE,EN,256809,256809," – Madam President, dear colleagues, Europe is full. In parallel with a strategic and cautious integration policy – which is a long‑term solution – the only answer is fostering returns. We should be especially alert in the context of instrumentalised immigration. During Lukashenko's hybrid attack on Lithuania, Latvia and Poland, around 150 000 illegal crossings were registered in a short‑time slot, and these crossings were accompanied by the special forces of Belarus, which in some cases forced the migrants to enter the European Union using their brutal armed force. Any kind of further escalation is possible in such a context. Our countries faced a need for an urgent solution.
We Lithuanians built a physical barrier on our own account in a record time, but what we really lacked was the common European‑wide approach to returns. The negotiations with third countries on admitting their nationals, for example Iraq, were complicated. Only together as the EU, we can do it.
To demolish Schengen and to build walls between ourselves is not a European solution. To strengthen the external borders and to foster the return process, this is the answer.",
55,Juan Fernando | López Aguilar,S-D,ES,96812,96812," – Señora presidenta, un fantasma recorre Europa: el fantasma de la negación y el rechazo al hecho migratorio, que solo podemos gestionar si lo hacemos juntos y de acuerdo con el Derecho europeo. Hemos trabajado muy duro por un pacto legislativo, que ahora requiere una ejecución leal y rigurosa, incompatible con la externalización de las fronteras y con la subcontratación de las solicitudes de asilo.
La carta de Von der Leyen «melonizando» la política europea es un grave error, una concesión estratégica a la extrema derecha, contradictoria con los hechos y con los intereses de la Unión Europea.
Y a los que están obsesionados con los retornos les digo que la prioridad es la inclusión, la prioridad es combatir las mafias y los tráficos ilícitos y, por supuesto, abrir vías legales y seguras.
Y, por tanto, le digo a la Comisión que es la hora de exigir a los Estados miembros el cumplimiento leal de sus obligaciones en virtud del Pacto, con responsabilidad compartida y solidaridad vinculante.",
56,Susanna | Ceccardi,PfE,IT,197786,197786," – Signora Presidente, onorevoli colleghi, un milione di mancati rimpatri di immigrati irregolari che meritavano l'espulsione: parliamo di questo. Ma quali sono state le azioni dell'Unione europea per evitare questa enorme falla nel nostro sistema di sicurezza? Niente, l'Unione europea non fa niente – anzi – mette i bastoni tra le ruote a qualsiasi iniziativa degli Stati membri per bloccare l'immigrazione irregolare.
In Italia abbiamo stipulato un patto con l'Albania per costruire là dei centri per il rimpatrio. Ma i giudici italiani stanno boicottando questa scelta, solo per opposizione politica. Sempre i giudici hanno mandato a processo Matteo Salvini per aver fermato l'immigrazione clandestina nel 2019 e a processo – pensate un po' – per sequestro di persona, come se fosse un criminale comune. Ha dell'incredibile, ma è questo che si sono inventati pur di bloccare chi è riuscito a dare risposte efficaci.
Secondo voi a chi delinque nei nostri paesi e non vuole integrarsi con la cultura europea e non rispetta i principi di uguaglianza tra uomo e donna, che cosa dovremmo fare? Dovremmo tenerceli tutti? Fermiamo l'ipocrisia e rispettiamo il mandato dei cittadini europei, che vogliono sicurezza e meno immigrazione.",
57,Sebastian | Tynkkynen,ECR,FI,256806,256806," – Arvoisa puhemies, ilolla katson, miten Eurooppa, Euroopan suunta maahanmuuttopolitiikan suhteen on muuttumassa. Puola torjuu välineellistettyä maahanmuuttoa Suomen esimerkkiä seuraten. Saksa palautti sisärajavalvontansa, ja nyt 17 EU-maata vaatii kiristyksiä EU:n palautuspolitiikkaan. Nämä 17 EU-maata eivät kuitenkaan ryhtyneet toimeen turhanpäiten, vaan nimenomaan siksi, että tehtävää todella riittää. Kielteisen turvapaikkapäätöksen saaneet muodostavat suuren turvallisuusriskin Euroopalle, joten tämän suunnanmuutoksen tapahtuminen oli vain ajan kysymys.
EU:n nykyinenkin löysääkin löysempi maahanmuuttopolitiikka on tehnyt Euroopasta entistäkin saavutettavamman Välimeren eteläpuoliselle elintasosiirtolaisuudelle, siis nimenomaan siirtolaisuudelle. Vai onko joku vieläkin sitä mieltä, että hädänalainen ihminen ei kulje ensimmäisenkään turvallisen maan läpi matkallaan Lähi-idästä Saksaan, Ruotsiin ja Suomeen?",
58,Hilde | Vautmans,Renew,NL,130100,130100," – Voorzitter, een correcte aanpak van migratie is cruciaal voor Europa. Wij pleiten voor een streng maar rechtvaardig migratiebeleid. Wij moeten bepalen wie Europa binnenkomt, niet de mensensmokkelaars. We weten ook wat we daarvoor moeten doen: versterk de buitengrenzen – die zijn nu een kaas met gaten –, voer het migratiepact uit en werk een Europees terugkeerbeleid uit, menselijk en humaan. Dat is wat er moet gebeuren.
Dan hebben we geen interne grenscontroles nodig. Dan hebben we vrij verkeer van goederen en personen, waaraan wij Europeanen zo gehecht zijn. Dat is cruciaal voor onze economie. Want, collega's, jullie weten toch: met die interne controles vangen we geen enkele illegaal, maar dwarsbomen we onze economie. Dan hebben we ook geen onzalige ideeën van surrogaatgevangenissen nodig.
De rechterzijde wil ik één ding heel graag zeggen: vergeet niet, collega’s, dat jullie het geluk hebben geboren te zijn in een land in vrede.",
